{
  "contract_version": 5,
  "suite": "media_state_contract",
  "case_id": "title_route_uses_item_id",
  "input": {
    "kind": "title_route",
    "payload": {
      "Id": "c1d2e3f4a5b6c7d8e9f0a1b2c3d4e5f6",
      "path": "/v1/metadata/items/c1d2e3f4a5b6c7d8e9f0a1b2c3d4e5f6",
      "OriginalTitle": null,
      "Overview": null,
      "Taglines": [],
      "ProductionYear": null,
      "PremiereDate": null,
      "CommunityRating": null,
      "OfficialRating": null,
      "Certification": null,
      "Genres": [],
      "RunTimeTicks": null,
      "Status": null,
      "ProviderIds": {
        "Tmdb": null,
        "Imdb": null,
        "Tvdb": null
      },
      "ImageTags": {
        "Primary": null,
        "Backdrop": [],
        "Logo": null,
        "Thumb": null,
        "Screenshot": []
      },
      "ParentImageTags": null,
      "SeriesId": null,
      "SeriesName": null,
      "SeasonId": null,
      "SeasonName": null,
      "ParentIndexNumber": null,
      "IndexNumber": null,
      "AbsoluteIndexNumber": null,
      "EpisodeTitle": null,
      "AirDate": null,
      "RemoteTrailers": [],
      "PosterColor": null,
      "BackdropColor": null,
      "UserData": null
    }
  },
  "expected": {
    "valid": true,
    "normalized": {
      "card_family": null,
      "item_id": "c1d2e3f4a5b6c7d8e9f0a1b2c3d4e5f6",
      "media_type": null,
      "title": null,
      "artwork_url": null,
      "subtitle": null,
      "progress_percent": null,
      "watched_at": null,
      "last_activity_at": null,
      "origins": null,
      "dismissible": null,
      "layout": null,
      "route_kind": "title"
    }
  }
}
