{
  "contract_version": 5,
  "suite": "media_state_contract",
  "case_id": "home_snapshot_section_preserves_exact_layout_value",
  "input": {
    "kind": "home_snapshot_section",
    "payload": {
      "listKey": "new-for-you",
      "title": "New for You",
      "subtitle": "Fresh recommendations",
      "layout": "landscape",
      "meta": {},
      "items": [
        {
          "itemId": "c2d3e4f5a6b7c8d9e0f1a2b3c4d5e6f7",
          "mediaType": "movie",
          "title": "Section Item",
          "subtitle": null,
          "overview": null,
          "year": null,
          "releaseDate": null,
          "rating": null,
          "maturityRating": null,
          "genres": [],
          "runtimeSeconds": null,
          "images": {
            "poster": null,
            "backdrop": null,
            "logo": null,
            "still": null
          },
          "progress": null,
          "parent": null
        }
      ]
    }
  },
  "expected": {
    "valid": true,
    "normalized": {
      "card_family": null,
      "item_id": null,
      "media_type": null,
      "title": null,
      "artwork_url": null,
      "subtitle": null,
      "progress_percent": null,
      "watched_at": null,
      "last_activity_at": null,
      "origins": null,
      "dismissible": null,
      "layout": "landscape",
      "route_kind": null
    }
  }
}
