{
  "contract_version": 5,
  "suite": "media_state_contract",
  "case_id": "search_or_recommendation_item_matches_server_contract",
  "input": {
    "kind": "recommendation_item",
    "payload": {
      "itemId": "d1e2f3a4b5c6d7e8f9a0b1c2d3e4f5a6",
      "mediaType": "tv",
      "title": "Recommended Show",
      "subtitle": "Because you watched mystery series",
      "overview": null,
      "year": 2024,
      "releaseDate": "2024-01-15",
      "rating": 8.2,
      "maturityRating": "TV-14",
      "genres": ["Mystery"],
      "runtimeSeconds": 2700,
      "images": {
        "poster": {
          "small": "https://image.example/poster-small.jpg",
          "medium": "https://image.example/poster-medium.jpg",
          "large": "https://image.example/poster-large.jpg"
        },
        "backdrop": {
          "small": "https://image.example/backdrop-small.jpg",
          "medium": "https://image.example/backdrop-medium.jpg",
          "large": "https://image.example/backdrop-large.jpg"
        },
        "logo": null,
        "still": null
      },
      "progress": {
        "played": false,
        "playCount": 0,
        "positionSeconds": 0,
        "durationSeconds": 2700,
        "percent": 12.5,
        "lastPlayedAt": null,
        "watchlisted": true,
        "userRating": null
      },
      "parent": {
        "seriesItemId": "series-1",
        "seriesTitle": "Recommended Show",
        "seasonItemId": "season-1",
        "seasonNumber": 1,
        "episodeNumber": null
      }
    }
  },
  "expected": {
    "valid": true,
    "normalized": {
      "card_family": "recommendation_item",
      "item_id": "d1e2f3a4b5c6d7e8f9a0b1c2d3e4f5a6",
      "media_type": "tv",
      "title": "Recommended Show",
      "artwork_url": "https://image.example/backdrop-medium.jpg",
      "subtitle": "Because you watched mystery series",
      "progress_percent": 12.5,
      "watched_at": null,
      "last_activity_at": null,
      "origins": null,
      "dismissible": null,
      "layout": null,
      "route_kind": null
    }
  }
}
