{
  "contract_version": 3,
  "suite": "media_state_contract",
  "case_id": "landscape_card_requires_backdrop_url",
  "input": {
    "kind": "landscape_card",
    "payload": {
      "Id": "show:tmdb:66732",
      "mediaType": "show",
      "title": "Stranger Things",
      "posterUrl": "https://img/stranger-poster.jpg",
      "OriginalTitle": null,
      "Overview": null,
      "Taglines": [],
      "ProductionYear": null,
      "PremiereDate": null,
      "CommunityRating": null,
      "OfficialRating": null,
      "Certification": null,
      "Genres": [],
      "RunTimeTicks": null,
      "Status": null,
      "ProviderIds": {
        "Tmdb": null,
        "Imdb": null,
        "Tvdb": null
      },
      "ImageTags": {
        "Primary": null,
        "Backdrop": [],
        "Logo": null,
        "Thumb": null,
        "Screenshot": []
      },
      "ParentImageTags": null,
      "SeriesId": null,
      "SeriesName": null,
      "SeasonId": null,
      "SeasonName": null,
      "ParentIndexNumber": null,
      "IndexNumber": null,
      "AbsoluteIndexNumber": null,
      "EpisodeTitle": null,
      "AirDate": null,
      "RemoteTrailers": [],
      "PosterColor": null,
      "BackdropColor": null,
      "UserData": null
    }
  },
  "expected": {
    "valid": false,
    "normalized": null
  }
}
